{"schema":"youi.usage/v1","project":"demo-app","system":"demo","commit":"5b8f4cbfc840d963c0f43098e0b9589e9cd51e05","scanner":"youi-scanner/0.1.0","configDigest":"b46df3e4e566","content":{"digest":"0ba756d5a26d","dirty":["components/ui/button.tsx","components/ui/input.tsx"],"dirtyCount":2,"overrides":[]},"generatedAt":"2026-10-12T20:26:16.545Z","durationMs":66,"status":"complete","coverage":{"filesMatched":10,"filesScanned":10,"failed":[]},"usages":[{"file":"app/_layout.tsx","line":8,"column":9,"routes":["/","/invite","/settings"],"routeSource":"shell","element":"youi:demo/component/input","kind":"render","export":"Input","local":"Input","props":{"type":{"literal":"search"},"placeholder":{"literal":"Search projects"},"className":{"literal":"max-w-xs"}},"spread":false,"fingerprint":"544df8100783"},{"file":"app/index.tsx","line":13,"column":9,"routes":["/"],"routeSource":"route-file","element":"youi:demo/component/button","kind":"render","export":"Button","local":"Button","props":{},"spread":false,"fingerprint":"4999bcae6301"},{"file":"app/index.tsx","line":16,"column":9,"routes":["/"],"routeSource":"route-file","element":"youi:demo/component/card","kind":"render","export":"Card","local":"Card","props":{"key":{"dynamic":"project.name"}},"spread":false,"fingerprint":"90a6b01ac18a"},{"file":"app/index.tsx","line":17,"column":11,"routes":["/"],"routeSource":"route-file","element":"youi:demo/component/card","kind":"render","export":"CardHeader","local":"CardHeader","props":{},"spread":false,"fingerprint":"1a220fc6cae8"},{"file":"app/index.tsx","line":18,"column":13,"routes":["/"],"routeSource":"route-file","element":"youi:demo/component/card","kind":"render","export":"CardTitle","local":"CardTitle","props":{},"spread":false,"fingerprint":"05d6ea6a80e2"},{"file":"app/index.tsx","line":19,"column":13,"routes":["/"],"routeSource":"route-file","element":"youi:demo/component/button","kind":"render","export":"Button","local":"Button","props":{"variant":{"literal":"outline"},"size":{"literal":"sm"}},"spread":false,"fingerprint":"4a564592ceb7"},{"file":"app/index.tsx","line":21,"column":11,"routes":["/"],"routeSource":"route-file","element":"youi:demo/component/card","kind":"render","export":"CardContent","local":"CardContent","props":{},"spread":false,"fingerprint":"a9efea971cf0"},{"file":"app/settings/index.tsx","line":6,"column":7,"routes":["/settings"],"routeSource":"route-file","element":"youi:demo/component/card","kind":"render","export":"Card","local":"Card","props":{},"spread":false,"fingerprint":"fc2a97a3ea56"},{"file":"app/settings/index.tsx","line":7,"column":9,"routes":["/settings"],"routeSource":"route-file","element":"youi:demo/component/card","kind":"render","export":"CardHeader","local":"CardHeader","props":{},"spread":false,"fingerprint":"2c589f7098a4"},{"file":"app/settings/index.tsx","line":8,"column":11,"routes":["/settings"],"routeSource":"route-file","element":"youi:demo/component/card","kind":"render","export":"CardTitle","local":"CardTitle","props":{},"spread":false,"fingerprint":"23102d4fa3ed"},{"file":"app/settings/index.tsx","line":10,"column":9,"routes":["/settings"],"routeSource":"route-file","element":"youi:demo/component/card","kind":"render","export":"CardContent","local":"CardContent","props":{},"spread":false,"fingerprint":"ba0e086957c3"},{"file":"app/settings/index.tsx","line":12,"column":11,"routes":["/settings"],"routeSource":"route-file","element":"youi:demo/component/input","kind":"render","export":"Input","local":"Input","props":{"id":{"literal":"name"},"defaultValue":{"literal":"Atlas"}},"spread":false,"fingerprint":"d999353fd1e7"},{"file":"app/settings/index.tsx","line":14,"column":11,"routes":["/settings"],"routeSource":"route-file","element":"youi:demo/component/input","kind":"render","export":"Input","local":"Input","props":{"id":{"literal":"slug"},"invalid":{"literal":true},"defaultValue":{"literal":"atlas!"},"aria-describedby":{"literal":"slug-error"}},"spread":false,"fingerprint":"c5a1c0e91a0e"},{"file":"app/settings/index.tsx","line":17,"column":13,"routes":["/settings"],"routeSource":"route-file","element":"youi:demo/component/button","kind":"render","export":"Button","local":"Button","props":{"variant":{"literal":"ghost"}},"spread":false,"fingerprint":"5795eb772b46"},{"file":"app/settings/index.tsx","line":18,"column":13,"routes":["/settings"],"routeSource":"route-file","element":"youi:demo/component/button","kind":"render","export":"Button","local":"Button","props":{},"spread":false,"fingerprint":"89c9c1ee59e7"},{"file":"app/settings/index.tsx","line":22,"column":7,"routes":["/settings"],"routeSource":"route-file","element":"youi:demo/component/card","kind":"render","export":"Card","local":"Card","props":{},"spread":false,"fingerprint":"06fd43982f68"},{"file":"app/settings/index.tsx","line":23,"column":9,"routes":["/settings"],"routeSource":"route-file","element":"youi:demo/component/card","kind":"render","export":"CardHeader","local":"CardHeader","props":{},"spread":false,"fingerprint":"321a1a99ca84"},{"file":"app/settings/index.tsx","line":24,"column":11,"routes":["/settings"],"routeSource":"route-file","element":"youi:demo/component/card","kind":"render","export":"CardTitle","local":"CardTitle","props":{},"spread":false,"fingerprint":"27cb55c98d76"},{"file":"app/settings/index.tsx","line":25,"column":11,"routes":["/settings"],"routeSource":"route-file","element":"youi:demo/component/button","kind":"render","export":"Button","local":"Button","props":{"variant":{"literal":"danger"}},"spread":false,"fingerprint":"303502536078"},{"file":"components/invite-form.tsx","line":5,"column":5,"routes":["/invite"],"routeSource":"imported-by","via":"app/invite/index.tsx","element":"youi:demo/component/card","kind":"render","export":"Card","local":"Card","props":{},"spread":false,"fingerprint":"68d184175a0d"},{"file":"components/invite-form.tsx","line":6,"column":7,"routes":["/invite"],"routeSource":"imported-by","via":"app/invite/index.tsx","element":"youi:demo/component/card","kind":"render","export":"CardHeader","local":"CardHeader","props":{},"spread":false,"fingerprint":"e3d6c377f3b7"},{"file":"components/invite-form.tsx","line":7,"column":9,"routes":["/invite"],"routeSource":"imported-by","via":"app/invite/index.tsx","element":"youi:demo/component/card","kind":"render","export":"CardTitle","local":"CardTitle","props":{},"spread":false,"fingerprint":"3b56ca9bb79f"},{"file":"components/invite-form.tsx","line":9,"column":7,"routes":["/invite"],"routeSource":"imported-by","via":"app/invite/index.tsx","element":"youi:demo/component/card","kind":"render","export":"CardContent","local":"CardContent","props":{},"spread":false,"fingerprint":"45907e32bef6"},{"file":"components/invite-form.tsx","line":11,"column":9,"routes":["/invite"],"routeSource":"imported-by","via":"app/invite/index.tsx","element":"youi:demo/component/input","kind":"render","export":"Input","local":"Input","props":{"id":{"literal":"email"},"type":{"literal":"email"},"placeholder":{"literal":"ada@example.com"}},"spread":false,"fingerprint":"b51e1c5f0622"},{"file":"components/invite-form.tsx","line":14,"column":11,"routes":["/invite"],"routeSource":"imported-by","via":"app/invite/index.tsx","element":"youi:demo/component/button","kind":"render","export":"Button","local":"Button","props":{},"spread":false,"fingerprint":"c681b5520097"}],"fileRoutes":{"app/_layout.tsx":{"routes":["/","/invite","/settings"],"routeSource":"shell"},"app/index.tsx":{"routes":["/"],"routeSource":"route-file"},"app/invite/index.tsx":{"routes":["/invite"],"routeSource":"route-file"},"app/settings/index.tsx":{"routes":["/settings"],"routeSource":"route-file"},"components/invite-form.tsx":{"routes":["/invite"],"routeSource":"imported-by","via":"app/invite/index.tsx"},"components/ui/button.tsx":{"routes":["/","/invite","/settings"],"routeSource":"imported-by","via":"app/index.tsx"},"components/ui/card.tsx":{"routes":["/","/invite","/settings"],"routeSource":"imported-by","via":"app/index.tsx"},"components/ui/index.ts":{"routes":["/","/invite","/settings"],"routeSource":"imported-by","via":"app/index.tsx"},"components/ui/input.tsx":{"routes":["/","/invite","/settings"],"routeSource":"imported-by","via":"app/index.tsx"},"components/ui/utils.ts":{"routes":["/","/invite","/settings"],"routeSource":"imported-by","via":"app/index.tsx"}},"unknowns":[],"suppressed":0,"lookalikes":[],"violations":[{"file":"app/index.tsx","line":24,"column":23,"rule":"youi:demo/rule/tokens.no-arbitrary-values","severity":"warn","message":"Arbitrary value rounded-[12px] copies a token.","text":"rounded-[12px]","suggestion":"rounded-card"},{"file":"app/settings/index.tsx","line":15,"column":47,"rule":"youi:demo/rule/color.no-raw-color","severity":"error","message":"Raw colour #c62828; use a colour token.","text":"#c62828","suggestion":"var(--demo-color-danger) (color.danger): same value, check it is the right role"},{"file":"components/invite-form.tsx","line":13,"column":11,"rule":"youi:demo/rule/components.no-native-controls","severity":"warn","message":"Native <button> styled by hand; render Button (youi:demo/component/button).","text":"<button>","suggestion":"<Button>"}],"checks":[{"rule":"youi:demo/rule/color.no-raw-color","state":"ran","findings":1},{"rule":"youi:demo/rule/components.canonical-import","state":"ran","findings":0},{"rule":"youi:demo/rule/components.no-native-controls","state":"ran","findings":1},{"rule":"youi:demo/rule/components.one-primary-action","state":"advisory"},{"rule":"youi:demo/rule/props.contract-values","state":"ran","findings":0},{"rule":"youi:demo/rule/tokens.no-arbitrary-values","state":"ran","findings":1}]}
